brand,alias
v,грнд оф лордс вс
apple,напиток спиртной джим бим эппл
santero,сантеро москато д'асти
langenlois,лоймер лангенлойс рислинг
noces,арди но де диамант
dor,а е дор наполеон
ried,хидлер рид лангенлуа таль грюнер вельтлинер
e,а е дор хо
blackberry,фруко шульц ежевика
blanc,николя фюят гран крю брют блан де нуар
solealto,солеальто бьянко спуманте экстра драй
de,сыр мягкий с белой плесенью камамбер де фамиль
fills,фацер с ликёром гр
gold,шарк тус голд
sapphire,бомбей сапфир драй
calvados,маркиз де мондидье
lecompte,леконт пей д'ож орижинель
blended,виски кинси
high,мэджик рок хай ваер грейпфрут
domaine,домен д'опийяк лю мазе
la,ла резерв д'англюде
de,конт луи де лористон фин
de,бессера де бельфон кюве де муан экстра брют
juve,жюве и кампс кава синта пурпура ресерва брют
tierras,карас
delle,портобелло пино гриджио делле венеция
ruby,крофт файн руби порт
deutz,амур де дейц брют розе
valley,монтграс ресерва шардоне
blanc,монтграс амарал совиньон блан
light,абрау лайт полусладкое
moscato,аморе мио москато
gobelsburg,домен гобельсбург цвайгельт
tawny,далва порто тони
carafe,шато де лобад экстра караф
wairau,ра нуи мальборо вайрау вэлли совиньон блан
heese,сыр чиз галлери пармерино
comte,комт луи де лористон ор д'аж
di,сенси коллегиата вернача ди сан джиминьяно
dry,виндзор кастл лондон драй джин
doc,планальто ресерва
windsor,виндзор кастл лондон драй джин
gran,флор де канья гран резерва
xo,черный аист хо
club,ром гавана клуб аньехо эспесиаль
cremant,креман д'эльзас кюве престиж брют
feuillatte,николя фюят брют резерв партикюльер
eugene,еужен розе
fraise,д`артим де фри
pinot,леонардо пино гриджио
d’or,коньяк арди но д'ор золотая свадьба лет
spumante,терра серена розе спуманте
gold,оле мексикана голд
colline,агамиум коллине новарези
rose,фанагория розе полусладкое
caribbean,балвени карибиан каск
deau,до
tosti,тости москато
bucket,ведерко для шампанского прозрачное с маркировкой
pinot,вилла виктория пино нуар семигорье
leda,каза феррейринья кинта да леда
mateus,матеуш розе
furst,рудольф фюрст шпетбургундер традицион
cantina,терланер классико
rosado,кастильо де альманса розадо
savigny-les-beaune,люпе-шоле савиньи-ле-бон ле пикотен
cranberry,финляндия клюква
classico,биббиано кьянти классико
dry,вальдо просекко экстра драй
cheese,сыр гауда выдержанный чиз галлери олдмил гр
sparkling,шлюмбергер спарклинг брют винтаж
massene,же массене о-де-ви слива вьей
bene,тутто бене москато спуманте полусладкий
family,креман д'эльзас бауманн фэмили истэйт
praepositus,аббация ди новачелла препозитус пино неро ризерва
old,др лоозен эрденер треппхен рислинг драй гроссес гевекс олд вайнс квалитетсвайн
soave,соаве примо альберо
d'oro,аббация москато розе фиорино д'оро
vino,бесо де вино сира гарнача кариньена до
legrand,барон г легран наполеон лет
la,шато ля гаренн бордо
aoc,дё монтий сёр-фрер бургонь пино нуар
o'zera,шоколад о'зера мадагаскар молочный
de,альтос де ла ойя монастрель до хумилья
rose,жауме серра брют розе
chateau,шато о-баж либераль
haut,шато о де барадью
vegante,сенси веганте кьянти супериоре
grüner,лет фреш энд изи грюнер вельтлинер
perfect,шпигелау перфект лонгдринк набор из х бокалов
ried,лет рид бруннталь премье крю рислинг
marquis,маркиз де гулен каберне д'анжу
creme,сыр мегле крем бланше мягкий с луком и томатами гр
carta,мокамбо карта бланка
du,шато дю пти лак
du,птит шампань крю дю коньяк коллексьон в с о п
loimer,лоймер лангенлойс рислинг
lord's,грнд оф лордс вс
g,гранд шампань премье крю шато де монтифо лет
satz,винер гемиштер затц дак
rose,каватина пино розе
mont,монт марсаль кюве нуар кава брют
speyside,маклелэнд`с спейсайд
rose,мирамэ розе брют
montepulciano,фонтегранде
prosecco,аббация просекко спуманте
hoppy,хоппи скулл пилс
o,меуков в с о п супериор в подарочной упаковке
reserve,паричская винарня хайленд резерв
grand,домен де маланде шабли гран крю ле кло
patrick,патрик жавилье бургонь блан кюве олигоцен
xo,хронос хо
jack,джек бренд драй хоппд лагер
et,жан-поль паке э фис домэн ле вьё мюр п йи-фюиссе
mumm,шампанское мумм кордон руж
livry,маркиза де ливри винтаж
glen,голден глен
frizzante,аббация ламбруско бьянко фриззанте
the,виски гленморанджи нектар д’ор
whiskey,хайлэнд куин шерри финиш
acquavite,пилцер аквавит ди пере вильямс
villa,вилла вольф пино нуар розе квалитетсвайн
prosecco,просекко супериоре
xo,шевалье д'эспале хо
stick,стик э фингер ин ве соил
loch,лох ломонд ориджинал сингл молт
docg,перлино асти
chene,шато ле ра кюве гран шен руж
alain,ален мия яблочный
luciano,дон лусиано
whiskey,граппа ризерва теннесси виски вуд финиш
pugil,эль пухиль темпранильо
extra,виникола серена вилла арфанта спуманте розе экстра драй
manzone,манзоне брикат бароло
rueda,камино де магарин
garnacha-tintorera,кастильо де альманса гарнача-тинторера тинто
martelle,мартель кордон блю
tempranillio,дон уго темпранильо
carabiniers,домен де карабинье тавель
dolce,тости дольче феста
di,сильвио нарди виньето поджо дория брунелло ди монтальчино
martini,мартини асти спуманте
veltliner,ленц мозер грюнер вельтлинер
burgundy,туллибардин бургунди финиш
finish,харт бразерс шерри финиш
de,маркиза де ливри винтаж
docg,сан клаудио
cru,домен де маланде шабли премье крю во де ве
pauillac,ля круа де гран-пюи дюкасс
morini,кантине кваттро валли паоло морини ламбруско россо
goedverwacht,грейт экспектейшнс совиньон блан
wellington,дюк оф веллингтон совиньон блан
dell'emilia,ламбруско дель эмилия каза рональди
l'atelier,штопор маркировкой ателье дю ван шеф оммелье
de,тиффон шато де триак
le,просекко рокка дей форти ле кюве
flamand,шато фламан бельвю руж
tutto,тутто бене бьянко
union,гавана клуб коиба атмосфера унион
rose,папилон ван ду розе
berneroy,кальвадос бернеруа фин
cru,шато де ла мальтруа шассань-монраше премье крю
farms,роуг фарм хоп ипа
pinotage,беллингем бернард сириез буш вайн пинотаж
luxe,кюве жан годе вс де люкс
leclerc,шампанское леклер брийан ля круазет
jacob's,джейкобс крик шардоне пино нуар
fins,рулле резерв де фамий фэн буа
tawny,порто круз тони
beam,джим бим ред стаг
bordeaux,шато ла монд бордо аос
riga,бальзам рижский черный со вкусом вишни
penderyn,пендерин портвуд
jean,жан лорон шатонеф-дю-пап
cream,фруко шульц крем де какао вайт
docg,канталупо анно примо
toschi,тоски амаретто
whisky,гленгойн сингл молт скотч виски бочковая крепкость
toscana,тоскана россо примо альберо
don,херес дон бенигно криам
er,шассань-монраше премье крю кло дю шато де ла мальтруа блан
cantosan,кантосан вердехо виньяс вьеха
vs,готье
e,пойер е сандри шардоне
aoc,шато лаланд-бори
tiefgang,вейнкеллерай хехтсхайм тиефганг шпетбургундер калкштейн
lager,фелднер марзен
grappa,граппа ризерва пино неро
semigorye,вилла виктория совиньон блан резерв
altos,ольмека альтос репосадо
moscato,сантеро москато д'асти
dalva,далва порто лет
antichi,агамиум коллине новарези
lambrusco,риальто ламбруско
verres,сушилка для бокалов эгутуар рэк
black,бушмилс блэк буш
cu,ку бокан бурбон каск
aoc,тур дэ пьер бордо
doq,блан де писсаррес
di,граппа ди корвина валлезелле
balsam,бальзам рижский черный
reserve,андре клуэ гран резерв брют белое
rajo,просекко тревизо колле сан лоренцо ка ди райо
l’enchantoir,тэрр пурпр сомюр
bottle,каватина мюллер-тургау брют
bianco,бьянко д италия вилла лори
ried,лет рид шиллингсберг рислинг
liqueur,фруко шульц личи
legrand,барон г легран всоп ба арманьяк
liqueur,фруко шульц грейпфрут
abbazia,аббация асти спуманте
xo,коньяк пьер де сегонзак х гранд шампаньселексьон дез анж
calon,шато калон
courvoisier,курвуазье вс
tobacco,тобакко спайсед
patrick,патрик жавилье савиньи-ле-бон премье крю ле серпантьер
maria,москато спуманте розе иль талисмано ди мария медичи
cavatina,каватина пино розе
xo,пьер де сегонзак хо резерв гранд шампань
fruko,фруко шульц зеленая мята
sport,шоколад риттер спорт молочный цельным миндалем
ruby,вальдоуру руби порто
still,гирван патент стилл
bourgeois,буржуа золотое полусладкое
lezak,карловец темное
organic,пакстон вайнз мв каберне совиньон органик
gallery,сырная тарелка чиз галери премиум сэт
brut,гран дуке селексион
early,эрли таймс олд
del,э меццо негроамаро
minerale,вода аква минерале актив цитрус
jacques,шато де жак кло де рошегре
brut,кроне бореалис винтедж кюве брют
superiore,марка оро просекко ди вальдобьядене
jarron,дё монтий сёр-фрер сен-ромэн ле жаррон
ii,сан клаудио
silver's,виски глен сильвер солодовый
extra,чивас ригал экстра
crublanc,кюве де моан гранд крю
cava,монт маркаль кава брют ресерва
pinot,рапаура спрингс пино нуар резерв
rio,готье икс о пина дель рио
principe,принчипе ди корлеоне нерелло маскалезе
macallan,макаллан мастерс эдишн
amstel,амстел безалкогольное
dulac,ф дюлак брют
meursault,патрик жавилье мерсо ле клузо
latte,буррата буон латте
red,альваро кастро
rioja,финка темпранильо
domaines,допфф ирион домэн дю шато де риквир рислинг ле мюрай
de,сантьяго де куба аньехо
croix,ля круа де гран-пюи дюкасс
aoc,лез анне фоль ла волюптюз
sparkling,вилла мария лайтли спарклинг совиньон блан
marsannay,фужре де боклер ле дессю де лонжеруа
herkenrode,херкенроде ноктис
espolon,эсполон бланко
aoc,бруно пайар премьер кюве розе брют
brut,такар экстра брют
gourmet,бушерон гурме конфеты с миндалем
xhd,зажигалка нс
porto,далва порто
chacabuco,чакабуко торронтес
crianza,кастильо де альманса крианца
vs,лейра
seal,мюрхэд'с сильвер сил метьюрити
aop,жюльен риль гевюрцтраминер
dartigalongue,дартигалонг ор д'аж
classico,рокка делле мачие кьянти классико
highland,хайлэнд куин меджисти
whisky,фруко шульц виски черри
malvolti,карпене мальвольти просекко суперьоре экстра драй
punched,рокстар панчд энерджи
ron,сантьяго де куба рон карта бланка
dolce,жан рош дольче
iposea,маслины без косточек без жидкости ипосея гр
williams,дос кортадос солера эспесиаль пало кортадо
vintage,семпэ вьей винтаж арманьяк
schulz,фруко шульц абсент красный
les,филипп шави мерсо премье крю ле шарм
xo,лейра элит
leopold,мичиган черри
fresh,нагреваемые табачные палочки парламент фреш с ментолом
xo,пьер де сегонзак гранд шампань иксо резерв
dorado,эль дорадо суперьор дарк
batch,элайджа крейг смолл бэтч
roederer,луи родерер брют премьер
the,дары моря из молочного шоколада с трюфельной начинкой гр
reserve,сандеман порто фаундерс резерве
estephe,шато кос лабори
liqueur,фруко шульц трипл сек
glenmorangie,гленморанджи компанта
muirhead's,мюрхэд'с сильвер сил метьюрити
vallet,шато де монтифо эритаж луи валле летней выдержки в деревянной коробке
domaine,тэрр пурпр сомюр
ancnoc,ан нок раттер
anejo,каса вьеха аньехо
malvasia,спуманте мальвазия дольче перини перини
doc,каза ферреринья винья гранде
park,парк хо
gran,жюве и кампс кава гран
d'empire,ноблесс дэ эмпая вайт
bushmills,бушмилс блэк буш
muscat,ла кротта ди веньерон шамбав мускат
deutz,дейц брют розе
sipp,луи сипп гроссберг пино нуар
nature,кава валльдосера брют натур
nikka,никка такетсуру пьюэ молт
alsace,луи сипп гроссберг пино нуар
sorrento,лимончелло ди сорренто
brut,абрау-дюрсо брют д'ор блан де блан
dei,рокка деи форти брют
a,шоколад феличита гелато каффе а летто с начинкой сливочно-кофейного мороженого
prelude,аладам монтаньи прелюд
compass,компас бокс оак кросс
spencerfield,шип дип
sommer,эрдингер соммер
e,э меццо мальвазия дель саленто
martelle,мартель всоп медальон
port,ризерва порт вуд финиш сибона
grande,фрапен всоп гран шампань премье гран крю коньяк
prosecco,перлино просекко
reserve,лейенда дель милагро селект баррель резерв сильвер
rojo,макинон гарнача
bracco,просекко
nebbiolo,ренато ратти окетти неббиоло д'альба
crus,шато ля франс деломм крю буржуа
igt,фиорино д'оро ламбруско розато фриззанте
de,кюваж блан де блан брют
de,маркиз де круазе
first,гленливет надурра фест фил селекшен
malandes,домен де маланде шабли премье крю фуршом
rose,боке розе брют франчакорта вилла
mr,мистер стэчерс джин
pere,кальвадос пер маглуар файн вс
vintage,моэт и шандон гран винтаж
verdier,трезор де луар
port,черчилльс резерв порт
imperial,крушовице империал
catalanes,эсприт де л'оризон руж
igt,чив чив ле фолие ламбруско бьянко делле эмилия амабиле
du,резерв дю шато
rauzan,шато тарис бордо
aoc,шато озон сент-эмилион премьер гран крю
rose,бруно пайар премьер кюве розе брют
añejo,эль рон проибидо ресерва аньехо
campania,лакримароза
tiffon,тиффон резерв всоп
malt,инчмоан сингл молт лет
re,корино чабот дю ре
maiorum,море майорум
gran,гран дуке д'альба
terlano,монтиколь пино нуар ризерва
praepositus,препозитус сильванер
massene,же массене о-де-ви имбирь
blan,опера блан де блан полусладкое
fruko,фруко шульц крем де банан
velkopopovicky,пиво велкопоповицкий козел темное
de,маркиз де гулен каберне д'анжу
cayo,кайо гранде клуб аньехо ресерва
old,далва порто лет
aoc,шато бомон
family,грейт экспектейшнс шираз
gran,мастио делла лоджа гран кюве дольче
carbonaione,иль карбонайоне
bouju,даниэль бужу
de,викторин де шастенэ креман де бургонь брют аос
chai,ром букатики чайный
scottish,скотиш фэлкон
ferdinand's,фердинанд'с саар драй
ida,миа ида брют розе
bene,тутто бене бьянко
doc,просекко нуа
chablis,шато де вивье шабли премье крю вокопин
quarter,арран боти квортер каск
aoc,домен дюкло ля жермин кот-роти
peat,пит чимней бэтч стренгс
trevallon,домен де треваллон руж
bear,стоунстрит биар поинт виньярд каберне совиньон
docg,боргетто кьянти ризерва
whisky,блэк бист
willsberger,шпигелау виллсбергер анниверсари набор из х бокалов для шампанского
sibona,неббиоло сибона
cocktail,шпигелау перфект набор из х коктейльных бокалов
vsop,маркиз д'агессо
deutz,дейц блан де блан
emilia,эль гризо ламбруско делл'емилиа
single,джек дэниэлс сингл баррель
brut,р де рюинар брют
rosso,пойер и сандри мерлино россо фортификато доломити
er,филипп шави мерсо премье крю ле шарм
terlano,лагрейн грис резерва
xo,фавро хо
twix,печенье твикс в молочном шоколаде с карамелью
er,альбер бишо жевре-шамбертен премьер крю лаво сен жак
opera,опера блан де блан полусладкое
dolcetto,граппа барберо дольчетто
prestige,креман д'эльзас кюве престиж брют
de,блан де писсаррес
guido,дон гуидо педро хименес солера эспесиаль
rapel,санта каролина резерва шардоне
no,раньо сабурэн гран шампань крю вс
guinness,гиннесс драфт
lbv,сандеман порто лбв
orchards,беллингем хоумстед олд орчадз шенен блан
belhaven,белхевен маккалум'с сладкий стаут
doc,вальдо просекко экстра драй
famille,бри де фамиль
oddero,оддеро барбера д'альба супериоре
camus,камю
tea,ром букатики чайный
prestige,тэтэнжэ брют престиж розе
duero,вега лара
beauclair,фужре де боклер кло марион руж
et,маркиз де гулен мюскаде сэвр-э-мэн сюр ли
mendoza,оро негро бонарда-мальбек
pinot,итало ческон пино гриджио
grüner,лет рид шаффлерберг грюнер вельтлинер
aoc,луи сипп рислинг
non-alcoholic,баклер безалкогольное
triomphe,мон триумф розе брют
icaro,декантер икаро
wild,электронный испаритель понс вайлд черри
blanc,кюве пино блан экстра брют
ferrero,набор конфет ферреро коллекшн
glen,глен элгин лет
reserve,даниэль бужу резерв гурме
hiedler,хидлер рид когельберг премье крю рислинг резерв
emilia,палестро ламбруско эмилия
reserva,планальто ресерва
grande,коньяк пьер де сегонзак х гранд шампаньселексьон дез анж
albert,альберт жаро хо
b,дж б бурлотто бароло
dop,папале линия оро примитиво ди мандурия
vsop,черный аист всоп
serra,жауме серра кава брют
sperone,спуманте розе чилл спероне
rouge,бласон руж креман брют
dartigalongue,дартигалонг хо
anejo,эль реформадор аньехо
vivere,кантини куатро валли ламбруско миа вивере
hoya,альтос де ла ойя монастрель до хумилья
hedonism,компас бокс гедонизм
trilogia,шоколад шогеттен карамель трилогия
porto,порто азул португал руби
treviso,монтеллиана просекко тревизо
pays,кальвадос пейс д'оге дарон хо
gran,монт маркаль гран кюве кава брют ресерва
bourgeois,шато о-бретон ларигодьер крю буржуа марго
sambuca,гранд самбука ди канале
