brand,alias
du,штопор маркировкой л'ателье дю ван помпового типа без картриджа черный
filtration,дрова очищенная дубовым углем
with,акура красная со вкусом сливы
sicilia,палари санта не
cristal,луи родерер кристалл брют
azul,порто азул португал уайт
chateau,шато фламан бельвю руж
cork,индикатор пузырьков баббл индикатор
monteguelfo,монтегуэлфо ле лепри
talismano,москато спуманте розе иль талисмано ди мария медичи
grigio,лис нерис грис пино гриджио
riginal,дарнлей`з ориджинал
spiced,пряный ром такамака
d'alsace,вольфберже креман д'эльзас розе
classico,лабертини бардолино кьяретто классико
villa,вилла виктория пино гри семигорье розе
brut,креман д'эльзас кюве престиж брют
pinot,вилла вольф пино нуар розе квалитетсвайн
aquileia,ка'туллио патриарка рефоско даль педунколо россо
dew,талмор дью летней выдержки
classico,ленотти соаве классико
cuvee,бруно пайар премьер кюве розе брют
do,де ла финка брют
borgo,игристое вино просекко борго алато
liard,патрик жавилье савиньи-ле-бон ле гран лиар
pear,же массене о-де-ви груша вилльямс веп
augustijn,августин брюн
oak,виски окентошан американ оук
sibona,ризерва барбареско туттоградо сибона
ancona,пуэрто анкона ла поста доминго фаццио
siciliane,принчипе ди корлеоне нерелло маскалезе
superiore,конельяно вальдоббьядене просекко супериоре
fils,жан-поль паке э фис домэн ле вьё мюр п йи-фюиссе
doc,колли вичентини просекко
setzen,маркус хубер грюнер вельтлинер рид альте зетцен резерв
captain,капитан морган блэк
la,ля круа де гран-пюи дюкасс
roc,рок дю пренс блан полусладкое бордо
venezie,портобелло мерло делле венеция
absolut,абсолют перец
stax,лейс стакс сметана и лук
rojo,падро ко рохо класико
cabernet,рамерси селлез каберне совиньон
point,стоунстрит биар поинт виньярд каберне совиньон
segonzac,коньяк пьер де сегонзак х гранд шампаньселексьон дез анж
alphonse,альфонс мелло женерасьон диз-нёф
japanese,хибики джапаниз хармони
villa,вила вульф вахенхаймер рислинг кабинетт предикатсвайн
tempranillo,кондеса де леганса темпранильо крианса
x,максим трижоль хо
chateau,гранд шампань премье крю шато де монтифо лет
tropical,ром тропикал чай блэк маск
digestive,шпигелау виллсбергер анниверсари набор из х бокалов для дижестива
makedonsko,стоби македонское красное
i,и проньи рипассо
pinot,пенон пино бьянко
schulz,фруко шульц сливочный
cote,шабли премье крю кот де леше
absinth,фруко шульц абсент черный
reserva,флор де канья гран резерва
de,шато пей-боном ле тур
pigeonnier,ле пижонье вьей винь
rioja,кюне гран ресерва
byass,дель дюк амонтильядо
ferriol,ферриоль брют
rare,хайн рар в с о п
barolo,ренато ратти бароло марченаско
branco,портас де лисбоа
spumante,кон-тре пино гриджио спуманте миллезимато экстра драй
garcon,штопор маркировкой гарсон металлический хромированный в блистере
valdobbiadene,просекко вальдобьядене супериоре ди картицце
chevalier,шевалье д'эспале традишн вс
brut,кава арт латино
wedel,конфеты дельчино е ведель маршмеллоу в молочном шоколаде гр
tullibardine,туллибардин сотерн финиш
semigorye,вилла виктория пино нуар семигорье
rosso,кантине кваттро валли паоло морини ламбруско россо
lh,леро вс
murganheira,игристое вино мурганейра царь гран кюве
mirella,кантини кваттро валли ламбруско виа мирелла голд
del,ка'туллио фриулано
beach,мавам бич
pangea,пангеа
reserve,креман д'эльзас брют резерв
wine,зб вайн москато крым
polugar,полугар мед и перец
hofbräu,пиво хофброй октоберфест светлое
toscana,каретти бьянко
cream,херес элегант крим
do,кинта ду кардо тинто
breuil,кальвадос всоп
de,шасенэ д'арс блан де блан
de,фонкалье резерв де л'аббе кот-дю-рон
xo,тиффон фин шампань хо
xo,а де фуссиньи фин шампань
brut,ла вида аль камп кава брют
d,ф монтепульчано д'абруццо
black,белхавен блек скоттиш стаут
tomatin,томатин легаси
docg,корвеццо просекко брют
les,шабли аос ле венерабль вьей винь
aoc,шабли премье крю боруа
vsop,ларрессангл
do,каса рохо эль кордо дель сирко вердехо руэда
il,иль валоре треббьяно д'абруццо
hunter,траффл хантер леда казароса
spiegelau,декантер шпигелау пиза
papale,папале линия оро примитиво ди мандурия
curant,сидр келвиш яблоко чёрная смородина
a,кло багатель а л'ориджин
cru,шато карбоньё блан
toblerone,шоколад тоблерон горький с медом и нугой
electro,жевательная резинка ригли электро мятный разряд гр
ipa,индиа пэйл эль ипа
rouge,домен де пиньян кот дю рон руж
de,маркиз де виториа экко
campero,камперо карменер резерва
brut,мм кава резерва де ла фамилиа брют розе
bianco,джаконди ламбруско бьянко
rose,далва розе порто
bordeaux,шато дю корне блан
india,индиа пэйл эль ипа
nicolas,николя фюят гран крю брют блан де нуар
nera,кантине лунае верментино этикетта нера
salute,виски чивас роял салют летней выдержки
lanson,лансон айвори лейбл деми-сек
vsop,лейра резерв
of,дюк оф веллингтон шираз
ile,камю иль де ре клифсайд селлар
igt,джаконди ламбруско россо
cockburn’s,вино ликерное кокбернс файн вайт порт
hc,зажигалка нс
varda,амаро ди эрбе э радичи
loimer,лоймер террассен пино нуар нидеростеррайх
brut,джейо просекко док
johnnie,джонни уокер дабл блэк
style,бокал шпигелау стайл софтдринк набор из х бокалов
griso,эль гризо брют
do,бесо де вино олд вайн гарнача
brut,ж лассаль преферанс брют премье крю шини-ле-роз
old,др лоозен урцигер вюрцгартен рислинг драй гроссес гевекс олд вайнс квалитетсвайн
by,нау бай пакстон шираз
xo,доббэ иксо экстра
premium,милвуд премиум крем ликер
spumante,спуманте розе чилл спероне
svetle,черновар светлое
chateau,шато ля калисс
chambave,ла кротта ди веньерон шамбав мускат
griso,эль гризо ламбруско делл'емилиа
mont,монт маркаль экстремариум кава брют натуре ресерва
colli,колли вичентини просекко
inchmurrin,инчмуррин сингл молт мадейра вуд финиш
bourbon,бурбон маршалл'с
fonte,фонте конельяно вальдобьядене просекко суперьоре
aoc,люпе-шоле сен-ромен
aop,ле пижонье вьей винь
rose,декорди москато розе
je,же массене о-де-ви вишня ориджин
porto,сандеман тони порто летний
edition,макаллан мастерс эдишн
grande,андилиано гран кюве десерт
garden,армениан гарден абрикосовый
de,абей де сен мартен трипль
hixson,хиксон джин
reserve,карас резерв выдержанное
brut,нумеро методо классико
terre,принчипе ди корлеоне грилло
pacific,ром букатики темный
valdobbiadene,вальдоббиадене просекко супериоре
noir,луи сипп гроссберг пино нуар
dublin,даблин либертис коппер элли сингл молт лет
interior,кинта ду кардо резерва турига насьональ
aoc,домен рене бувье вон-романе ле круа бланш
hill,хэвэн хилл олд стайл
exotisches,рипер б экзотишес ипа
stout,имперский стаут раскольников
reserva,ундуррага аливен каберне совиньон-сира резерва
o,у таль да лиша
xo,растиньяк хо
docg,феррина асти
chateau,шато карбоньё блан
pitia,высшие пития тминный
liqueur,фруко шульц маракуйя
pessac-leognan,ля пард де о-байи
philippe,филипп шави мерсо премье крю ле шарм
vsop,прунье всоп
bordeaux,дюпре блан семи-свит
don,дон кортес сильвер
milagro,легенда дель милагро селект баррель резерве аньехо
vsop,кальвадос комт луи де лористон всоп
the,бабич пэтриарк хокс бэй
frizzante,ламбруско дель эмилья фриццанте амабиле бьянко модавин
zlaty,золотой фазан
rning,средство от похмелья монинг кэа
gold,мартенс голд
reserve,роусонс'с резерв
aveleda,
do,милманда
amstel,амстел премиум пилсенер
frizzante,сенто фризанте розовое
crots,луи латур нюи-сен-жорж премье крю ле кро
baruaud,шато барюо бордо аос
rose,дейц брют розе
porto,сандеман файн уайт порто
melon,мидори дынный
islay,маклелэнд'с айла
rioja,контино гран ресерва
cider,сидр яблочный полусладкий
vermentino,сенси мандариано верментино
rocca,рокка делле мачие кьянти классико
cabernet,сан тельмо каберне совиньон
grigio,ф пино гриджио
i,и сомельери монферрато дольчетто
do,сонс де прадес
chabasse,шабасс в с о п
armagnac,барон г легран
tinazzi,тинацци виктория
santa,санта маргарита брют просекко супериоре ди вальдоббьядене
rosado,фрешенет кава кордон росадо
agavita,агавита аньехо
le,ле олле
sancho,санчо гарсес темпранильо
brut,роже гуляр резерва брют
de,абей де сен мартен брюн
des,пьер ферран селексьон дез анж
clos,клос дес дюкс грушевый
reserve,тэтенжэ брют резерв
daron,кальвадос пейс д'оге дароон шейн
apollo,пробка силиконовая аполло генио геометри
d'anjou,маркиз де гулен каберне д'анжу
chateau,шато ламонжо о-медок
cuba,сантьяго де куба рон аньехо
white,далва порто драй уайт лет
latino,жауме серра арте латино кава секо
charmes,филипп шави мерсо премье крю ле шарм
v,гранд оф лордс всоп
cremant,бласон руж креман брют
dip,шип дип айла блендид молт
anri,анри вс
reserve,кокбернс спешиал резерв
torres,санта дигна резерва карменере
bois,рулле резерв де фамий фэн буа
super,рапузейра блан де нуар брют
small,элайджа крейг смолл бэтч
zignum,зигнум репосадо
doc,санчо гарсес темпранильо
d'age,кальвадос пьер юэ ор д'аж лет
l'aspic,шато ля тур л'аспик
blancs,альфред грасьен брют блан де блан
veltliner,хидлер рид лангенлуа таль грюнер вельтлинер
cabardes,лез анне фоль ла волюптюз
di,папале линия оро примитиво ди мандурия
doc,виникола серена вилла арфанта бьянко экстра драй просекко ди тревизо просекко
acquavite,пилцер аквавит ди альбикокке
friulano,зорзон фриулано коллио
limoux,бласон руж креман брют
iron,креман д'эльзас брют блан де блан
valmer,дюк де вальмер полусухое
aoc,шато ла фавьер
verde,мела верде
riesling,альцингер дюрнштайнер рислинг смарагд
superiore,туффо моргасси супериоре
beauroy,шабли премье крю боруа
o,меуков
fit,богутти чоко фит печенье с шоколадной крошкой и клюквой
kriek,белль вю крик экстра
muga,монте ори темпранильо мерло наварра
spiegelau,шпигелау аутентис набор из х бокалов для красного вина
la,альфонс мелло ля мусьер розе
d'arce,шансэне дарс кюве ренуар розе брют
grand,шато о-баж либераль
brut,маркиз де рекена кавав брют натюр
arrogant,стоун аррогант бастард эль
campoluce,сенси камполюче кьянти биолоджико
de,бланш де норманди
sento,сенто фризанте красное
grigio,лис нерис пино гриджио
skoff,скофф классик мориллон
lagrein,кантина лавис лагрейн
treviso,ла джойоза просекко тревизо брют
grenache,идеальное сочетание курица и индейка сира гренаш
tariquet,домэн дю тарике л'иде фоль
old,крофт тони порт летний
white,калем уайт драй
lambrusco,бьянко да ламбруско кавиккьоли
is,жевательная резинка лав из микс
igt,ле станце дель полициано
rose,кава арт латино
sabourin,раньо сабурэн флорилеж
erdener,др лоозен эрденер треппхен рислинг шпетлезе предикатсвайн
bianco,паоло морини спуманте бьянко дольче
feuillatte,николя фейят пальм д’ор брют розе
margaux,шато д'англюде
margherita,санта маргерита розе
plum,акура красная со вкусом сливы
e,а е дор голд
berg,маркус хубер рислинг рид берг резерв
blanc,шампань жакарт блан де блан винтаж
double,эритаж дабл каск
factory,каса рохо александр вс хэм фэктори крианса рибера дель дуэро
doc,фрателли левис пьемонт барбера
chablis,домен лон-депаки шабли гранд крю ле водезир
mejicana,ла мехикана бланко
cuve,монтеллиана кюве соврано глера
macallan,макаллан файн ок лет
millesimato,кон-тре розе спуманте миллезимато экстра драй
forgotten,фоготен филд бранко
doc,роял опорту руби
doc,тенута дель мело пьемонт барбера
colli,ка'туллио каберне фран
telmo,сан тельмо пино нуар
sherry,хайлэнд куин шерри финиш
napoleon,франсуа войе наполеон гранд шампань
elgin,глен элгин лет
de,шато де ла мальтруа шассань-монраше премье крю
williams,канаста
middle,роял яблочный полусухой
dry,пьера мартеллоццо карати экстра драй просекко
fresh,жевательная резинка джус фреш лотте гр
o,кальвадос всоп
sombreros,текила трес сомбрерос серебряная
fruko,фруко шульц личи
kloster,клостер эбербах рислинг сект
d`avola,неро д`авола терре сичилиане беларди
navarra,монте ори росадо
la,серраденари бароло ла ветта
de,шато ля круа де ге
agamium,агамиум коллине новарези
messicano,мессикано альтено голд
doge,просекко ка дель додже
porto,кинта ду крашту лейт ботлд винтаж порто
plum,же массене о-де-ви алыча ориджин
blanc,равентос и блан блан де блан брют
blanc,заттлерхоф зюдштайермарк совиньон блан
premier,франсуа войе всоп гранд шампань
xo,доббэ иксо гранд сенчури
vs,кло мартен вс
champagne,шато де монтифо эритаж луи валле летней выдержки в деревянной коробке
glengoyne,гленгойн бочковая крепость
clos,кло мартен всоп
reserva,кюне гран ресерва
blue,фруко шульц блю кюрасао
wild,сидр кингстон пресс ваилд берри флэворед сидр
pinot,мастио делла лоджа пино гриджио
grande,франсуа войе наполеон гранд шампань
glorywood,глори вуд яблочный полусладкий
liberties,зе даблин либертис оак девил
brut,джейкобс крик шардоне пино нуар
atmosphere,каватина мюллер-тургау брют
orbit,жевательная резинка орбит для детей
cidre,роял со сливой
blanco,ранчо алегре бланко
ripasso,ламберти вальполичелла рипассо
white,моцарт белый шоколад крем ваниль
perrier-jouet,перрье жуэ бэлль эпок розе
saint-estephe,шато л'аржилюс дю руа
monferrato,тиморгассо
reserve,резерв тони баррос
villa,вилла винченти
tradition,олд традишн
de,шато смит о лафит крю классе пессак леоньян
de,бессера де бельфон кюве де муан брют розе
crozes-hermitage,ля матиниер кроз-эрмитаж
jaume,жауме серра брют розе
s,камю всоп элеганс
superior,меуков в с о п супериор в подарочной упаковке
tennessee,граппа ризерва теннесси виски вуд финиш
manzone,кастеллетто бароло
pons,электронный испаритель понс исе персональный
corn,шоколад шогеттен роастед корн
riesling,допф айрон рислинг гран крю шоненбург
de,пьер де сегонзак премиум
gelas,желас синг каск лет
pure,а де фуссиньи пюр органик всоп
friuli,ка'туллио мюллер тургау
jose,коктейль из оливок и солений г
reserva,камперо резерва совиньон блан
ponsardin,вдова клико винтаж розе
blanche,парк вс карт бланш
vieil,вьей арманьяк де р п корделье
bagatelle,сентье де багатель доннадью
minini,минини пино гриджио
grisi,сира бальо ди гризи
dry,далва драй уайт порто
compte,форе дэ конт
ried,хидлер рид лангенлуа киттманнсберг премье крю грюнер вельтлинер резерв
bembel,сидр бембель апфельвайн пур
de,диамант руаяль блан де блан брют
tierras,карас дютич
ux,дё монтий сёр-фрер сен-ромэн ле жаррон
proscuitto,парашутто крудо
brut,равентос и блан блан де блан брют
jean,жан лорон божоле
tawny,тони баррос лет
luxlite,электронное антитабачное устройство люкслайт вирджиния кофе
don,дон лусиано москато
venezia,бокал для мартини венеция шт
gueydon,шато гедо
j,дж дж курберг золотой корень
ans,пьер юэ вьей резерв лет
symbole,семболь националь хо
d’alsace,вольфберже креман д'эльзас шардон
xo,а е дор хо
doc,альваро кастро
aoc,шато кантелудетт антр-де-мер аос
lis,конфини
solera,капа негра солера резерва
bertagnolli,грапино бьянко
shot,метакса
port,кавалан солист порт каск сингл каск стренгс
aoc,альберт бишо фисен
blanc,винобль дамп шабли традисьён
verdejo,куатро райас р вердехо
igt,мастроберардино нероамета
calvados,кальвадос кокрель фин
soleil,мезон дю солей мерло
patrick,патрик жавилье савиньи-ле-бон ле гран лиар
chateau,шато д'англюде
latte,буон латте
docg,креде просекко ди вальдоббьядене супериоре докг
chateau,шато л'ермитаж эдонист
pauillac,шато о-баж либераль
barolo,манзоне грамолере бароло ризерва
del,каса рохо александр вс хэм фэктори крианса рибера дель дуэро
del,бинелли премиум ламбруско бьянко
don,дон алехандро силвер
dor,а е дор эмблема
doc,зонин просекко в подарочной коробке
cruzado,дон крусадо золотая
premium,варштайнер премиум бир
loch,лох ломонд сингл молт лет
stone,стоун руинейшн дабл ипа
villa,вилла виктория софия семигорье
pear,дивино мескаль ховен с грушей
rose,феррари розе брют
quinta,порто кинта да гайвоса лб
catalanes,домен де л'оризон мар и мантанья
doc,перлино просекко
petite,птит шампань крю дю коньяк коллексьон в с о п
heritage,рулле эритаж
dry,филльерс драй джин выдержанный
docg,зонин престиж вальдоббиадене просекко супериоре
kurberg,дж дж курберг золотой корень
