brand,alias
dionisio,декантер дионисио щетка для мытья декантера
don,херес дон бенигно медиум
gran,эль рон проибидо гран ресерва солера файнест блендед
cabernet,маркиз де гулен каберне д'анжу
umeshu,винный напиток чойа умешу с плодами сливы
domdechant,домдешан вернер гутц-рислинг трокен
coteaux,луи жадо кото бургиньон
rouge,ля мусьер
ron,сантьяго де куба рон аньехо
bellingham,беллингем хоумстед совиньон блан
chandon,моэт и шандон империал
rosso,принчипе ди корлеоне иль россо
salute,роял салют даймонд трибут
smaragd,альцингер рислинг лойбенберг смарагд
ledaig,ледчиг харт бразерс
villa,вилла марчелло миллезимато просекко
dupuy,дюпюи экстра
babich,бабич пэтриарк хокс бэй
san,иль пумо россо
wine,шпигелау стайл набор из х бокалов для белого вина
aoc,деламотт брют
besserat,кюве де моан гранд крю
naturtrubes,вольпертингер пшеничное хефевайсбир
cliche,френч клише совиньон блан коломбар
martellozzo,пьера мартеллоццо карати пино гриджио брют
pull,штопор вакувин сингл пул красный
kozel,велкопоповицкий козел темное
reserva,камперо карменер резерва
timmermans,пиво тиммерманс крик ламбикус вишневое
reservado,писко капель резервадо
islay,брукладди айла барли
pinot,кантина терлано пино бьянко
dry,черчилль'с уайт порт драй аперитив
toscana,фонтедочча
docg,акуэзи москато д'асти
de,вальдо оро блан де блан экстра драй
del,доломити терре дель ноче пино гриджо
pinot,вилла виктория пино гри семигорье розе
rose,ла джойоза розеа розе брют
blanco,эль амо бланко премиум
chateau,шато де рико бордо аос
l'horizon,домен де л'оризон мар и мантанья
cidre,сидр керисак бретон брют
rivaner,биоребе рислинг риванер
anos,гавана клуб года
onza,онза сильвер
igt,монтегуэлфо и мерли
fiorino,фиорино д'оро ламбруско бьянко
chateau,резерв дю шато
spumante,сенсейшен москато спуманте
premier,хидлер рид лангенлуа киттманнсберг премье крю грюнер вельтлинер резерв
brut,маззолада просекко миллезимато брют
apollo,пробка с фиксатором аполло асти
brut,прелюд гран крю брют
brut,пайпер-хайдсик брют
cuvée,ла кюве бистро де пюи арно
vermentino,винья'нджена
spirit,тилинг спирит оф дублин
brut,каватина просекко брют
vista,феста ла виста россо
igt,тоскана россо каретти
docg,барон уго кьянти классико
saouma,кло саума шатонеф-дю-пап омниа
toscano,сорелли бьянко тоскано
piacere,пичере ди фрутта фраголино
pi,пиколь
roullet,рулле резерв де фамий фэн буа
white,шлюмбергер уайт секко
moinet,моинет просекко
fiorenza,данте ди фьоренза кьянти
bordeaux,шато фламан бельвю руж
voluptueuse,лез анне фоль ла волюптюз
rosso,кантини куатро валли ламбруско миа вивере
de,шато де вивье шабли премье крю вайон
cayo,кайо гранде клуб бланко ресерва
aoc,ля пард де о-байи
j,ж лассаль преферанс брют премье крю шини-ле-роз
los,лос кантос де торремиланос
bols,болс черри бренди
ca'del,барбареско вальгранде
highland,паричская винарня хайленд резерв
roi,шато л'аржилюс дю руа
bianco,сорелли бьянко тоскано
bio,джейо вальдоббьядене просекко супериоре брют био
olmeca,ольмека тезон аньехо
lion,пэи д ож всоп
super,шоколадный батончик сникерс супер
abadia,абадиа ретуэрта селесьон эспесиаль
segur,шато фелан сегюр
dampt,винобль дамп шабли традисьён
merlot,вилла виктория мерло семигорье
russia,бытовая турбо зажигалка многоразовая
ribolla,лоренцон риболла джалла брют
prosecco,виникола серена вилла арфанта бьянко экстра драй просекко ди тревизо просекко
fougeray,фужре де боклер ле дессю де лонжеруа
puy,кло пюи арно кюве ле ормо
talisker,талискер шторм
cheverny,домен дю сальвар шеверни
premier,ж лассаль брют розе резерв де грандз анне премье крю шини-ле-роз
ferrero,набор конфет ферреро роше премиум т
antico,черазуоло д'абруццо доп роджо антико
royale,инжир в шоколаде шт
style,шпигелау стайл набор из х бокалов для белого вина
plaisir,авек плезир красный полусладкий
porto,копке порто лет
dr,др лоозен граахер химмельрайхь рислинг драй гроссес гевекс квалитетсвайн
cherry,рояль с вишней
delicate,лез анне фоль ла деликат
asyla,компасс бокс айла
barinoff,сок грушевый с мякотью баринофф
circo,каса рохо эль кордо дель сирко вердехо руэда
ortelli,шато ля калисс патрисия ортелли
cream,отн крим
wood,виски очентошн три вуд
i,карлос империал хо
corny,батончик корни милк злаковый с молоком и какао
chateau,шато тамань брют
oxford,вино оксфорд педро хименес
cava,маркиз де рекена кавав брют натюр
massene,же массене о-де-ви вишня ориджин
style,шпигелау стайл лонгдринк набор из х бокалов
rois,домен рене бувье жевре-шамбертен ле жен руа
bordeaux,ла флер де бернон бордо аос
cuatro,куатро райас органик вердехо
sento,сенто фризанте полусладкое
royal,виски чивас роял салют летней выдержки
manduria,папале линия оро примитиво ди мандурия
portugieser,португизер вайсхербст вайнхаус шнайдер
baron,барон г легран наполеон лет
brut,луи родерер брют премьер
vintage,шлюмбергер брют натюре винтаж куле
hengstenberg,коктейльные томаты с белым бальзамическим уксусом
perle,арди но де перль
chardonnay,минини шардоне
svetly,будвайзер будвар светлое фильтрованное
classic,охладительная рубашка для вина ваку вин классик
campero,камперо карменере
varda,фьори ди самбуко
spiegelau,шпигелау перфект дабл олд фэшн набор из х бокалов
marlborough,ра нуи мальборо вайрау вэлли пино нуар
incrocio,инкрочио манзони
sainte,сан сесиль руж
merci,шоколад молочный мерси
de,эсприт де л'оризон руж
excellence,реми мартан хо экселланс
aoc,дартигалонг хо
duke,дюк оф веллингтон пинотаж
aria,ария
organic,а де фуссиньи пюр органик всоп
arnaud,кло пюи арно
brunello,терра росса брунелло ди монтальчино
puerto,пуэрто анкона ла поста бланко
perlino,перлино просекко
puligny-montrachet,луи жадо пюлиньи-монраше премье крю ла гаренн
aoc,шато мулен де ля бридан аос гранд мэтр
brut,вдова клико понсардин брют
lorenzo,просекко тревизо колле сан лоренцо ка ди райо
loire,трезор де луар
croft,крофт тони порт летний
albert,альбер бишо жевре-шамбертен премьер крю лаво сен жак
cider,белхевен яблочный сидр
spitfire,спитфае премиум
reserva,жан леон винья ле авр ресерва
kunstler,кюнстлер хоххаймер херрнберг рислинг
fins,е дор пюр крю фэнс буа
rose,австрийская роза
spumante,монтеллиана монт розе спуманте
oban,обан малт летней выдержки
chablis,луи жадо шабли гран крю бланшо
ice,годэ антарктика айс вайт
festa,феста ла виста москато
victorine,викторин де шастенэ креман де бургонь брют розе аос
noir,джейкобс крик шардоне пино нуар
arnaud,ла кюве бистро де пюи арно
d'artim,д`артим де гранд оранж
marlborough,ра нуи мальборо вайрау вэлли совиньон блан
riesling,др лоозен эрденер треппхен рислинг шпетлезе предикатсвайн
himmelreich,др лоозен граахер химмельрайхь рислинг драй гроссес гевекс квалитетсвайн
napoleon,ронзард наполеон
vins,шевалье лакассан брют
fourchaume,шабли премье крю фуршом
grande,вдова клико ла гранд дам в упаковке от андре путман
gold,дон крусадо золотая
treviso,просекко тревизо меллезимато колле сан лоренцо ка ди райо
marques,маркиз де виториа крианса
chateau,шато тронкуа-лаланд
raventos,де ла финка брют
white,калдаш порто белое
vignes,пьер нежон шамболь-мюзиньи лез атэ вьей винь
san,сан балеро ресерва
brains,брэйнс блэк с азотной капсулой
hennessy,хеннесси вс
imperial,карлос империал хо
vinho,трес риос эсколья
rose,москато розе спуманте дольче
riesling,картхойзерхоф рислинг кабинет трокен
pralines,пралине золото эксельсиум ассорти гр
codax,мартин кодакс лиас альбариньо
foglie,чив чив ле фолие ламбруско ди модена секко
pumo,иль пумо россо
velha,реал компанья велья роял опорто колейта
savagny,домен де савани вэн жён
calisse,шато ля калисс
calda,валле кальда
cremant,луи сипп креман д'альзас брют
swiss,шоколад горький свисс ориджинал с кусочками апельсина гр
reserva,контино ресерва
wine,карас красное
provence,домен де ля санглиер ля ривьера
lima,портас де лисбоа
black,брэйнс блэк с азотной капсулой
gewurztraminer,гаумен шпиль гевюрцтраминер
exclusive,легенда кремля эксклюзив
porto,вальдоуру руби порто
ice,хайланд парк айс эдишн
teeling,тилинг айриш виски бленд
extra,курвуазье инисьяль экстра
great,грейт экспектейшнс коломбар
il,москато спуманте иль талисмано ди мария медичи
negro,оро негро бонарда-мальбек
rueda,куатро райас органик вердехо
leth,лет вайсбургундер резерв
sabourin,раньо сабурэн альянс хо гран шампань крю
jacquart,шампань жакарт деми сек мозаик
double,шпигелау перфект дабл олд фэшн набор из х бокалов
raspberry,абсолют малина
brut,кава эм си брют натур
grigio,леонардо пино гриджио
principe,принчипе ди корлеоне иль россо
cellar,камю иль де ре клифсайд селлар
cinnamon,спайсбокс корица
crus,птит шампань крю дю коньяк коллексьон в с о п
p,птит шампань шато де монтифо летний
excellence,жеизвелер экселанс блан де блан деми-сек
classique,альфред грасьен брют классик
la,ла кротта ди веньерон шамбав мускат
viviers,шато де вивье шабли премье крю вокопин
breg,домен циринга фосилни брег совиньон блан
uwe,уве шифер блауфранкиш кенигсберг
prosecco,боттер просекко спуманте
grigio,минини пино гриджио
homestead,беллингем хоумстед олд орчадз шенен блан
aoc,тет-де-муан марго фромажес
kasteel,кастель руже
lambrusco,ривата ламбруско эмилия бьянко
lambrusco,ламбруско розато дель’эмилия кавиккьоли
rose,контини аттилио розе
barbuda,барбуда ориджинал темный
flavour,акура белая со вкусом сливы
doc,вилла альба просекко
dei,мантенгья
cask,арморик шерри каск
sweet,лаветти классико сладкий
mickey,микки маус детское безалкогольное шампанское
alto,пенон пино бьянко
syrah,аниапп сира коламбия вэлли
pur,е дор пюр крю фэнс буа
bolgheri,арджентьера
morillon,скофф классик мориллон
vale,маскл мэн шираз
roulerie,магнолия
ale,прайвит сток эль
oro,вьехо де кальдас карта де оро лет
saint-estephe,шато фелан сегюр
absolut,абсолют ваниль
victoria,вилла виктория совиньон блан семигорье
riserva,граппа ризерва просекко
do,кастильо де альманса розадо
rose,мерсье брют розе
sorcieres,домэн дю шато де риквир гевюрцтраминер ле сорсьер
valtuille,эль кастро де вальтуилле ховен
vignoble,винобль дамп шабли премьер крю вокупан дамп фрэр
valgrande,барбареско вальгранде
bone,райхсрат фон буль бон драй розе
pilzer,пилцер граппа ди москато джалло
dessert,вдохновение вкус шоколадный брауни
rouge,шато смит о лафит крю классе пессак леоньян
savigny-les-beaune,патрик жавилье савиньи-ле-бон ле моншеневуа
extra,бессера де бельфон кюве де муан экстра брют
siciliane,принчипе ди корлеоне неро д'авола
malt,фэймос граус летней выдержки в подарочной упаковке
labeyrie,паштет террин утиный утка гр
jupiter,электронный пароиспаритель екосмос юпитер
wine,дегустационное ведерко для слива вина с пластиковой крышкой маркировкой
hors,комт жозеф ор д'аж икс о
red,джонни уокер рэд лэйбл
tabasco,смесь для коктейля кровавая мэри
bourgogne,креман де бургонь брют блан
terra,сыр горгонзола фасованный
doc,мацон пино нуар
dry,матеуш
fine,делафорс файн вайт порт
original,плантейшн ориджинал дарк
salette,и проньи рипассо
chablis,шато де вивье шабли гран крю бланшо
ruinart,дом рюинар розе
moisans,муазон вс
armagnac,ларрессангл наполеон
cuve,моинет блан де блан
crianza,бракамонте крианса
petite,птит шампань шато де монтифо
blanc,блан де писсаррес
brut,патриарш эритаж брют
chateau,шато л'эрмитаж сан сесиль розе
chateau,шато ла гравьер
barbera,барбера д'альба варей
almansa,бодегас пикерас кастильо де альманса колексьон резерва
doc,акуэзи кортезе
sec,крепкий тройной сухой трипл сек
cognac,готье вс
varvaglione,папале примитиво ди мандурия
terlano,терланер классико
arkle,ан нок питер аркл
tullibardine,туллибардин бургунди финиш
et,вино домэн берден э фис рёйи
chenin,бебилон'с пик шенен блан
old,олд баллантруан спейсайд гленливет
hayman's,хайман'с олд том
reserve,вилла виктория каберне фран резерв
duke,дюк оф веллингтон шинен блан
reserva,сегура виудас резерва эредад
gin,фердинанд'с саар драй
la,ла мехикана голд
dry,роял яблочный полусухой
anejo,капитан буканеро вьехо аньехо
italia,привалле италия спуманте дольче
grande,кельт кругосветное путешествие гранд шампань с двумя бокалами
d'alsace,люсьен альбрехт брют розе креман д'эльзас аос
karas,карас дютич
albero,тоскана россо примо альберо
reserve,рапузейра блан де нуар брют
reeper,рипер б блондес вайсбир
r,вайнгут р пфафль вена
bianco,морандо фраголино
iron,креман д'эльзас брют розе
margot,шато о-бретон ларигодьер крю буржуа марго
palestro,палестро ламбруско эмилия розовое
favraud,фавро хо
do,ла ина фино
nectar,д манговый нектар
pinot,доломити терре дель ноче пино гриджо
kelvish,келвиш яблоко-груша
blanco,падро ко бланко ресерва
five,жевательная резинка файв фрост леденящий шторм гр
barbero,граппа барберо дольчетто
porto,копке файн уайт порто
dalva,далва руби порто
mon,конфеты мон шери
cru,шато бомон
flandres,темный эль бургунь де фландер
rosato,феста ла виста розато
bacalhoa,монте дас амфорас
baron,трюфели барон французские со вкусом чили гр
x,меуков
muscadet,маркиз де гулен мюскаде сэвр-э-мэн сюр ли
romate,санчес ромате нпу амонтильядо
lux,пакет подарочный бс люкс х х
rolls,дэйз мини ухарики чеснок пармезан и ароматные травы
undurraga,ундуррага брют
brut,монт маркаль кава брют ресерва
cru,шабли премье крю фуршом
clos,кло дю пти шаван сомюр пюи нотр дам
de,кальвадос помм де виктор
cheese,идеальное сочетание сыр и крекеры мерло
rosado,монте ори росадо
alto,говядина альто конкетто сыровяленая гр
bas,дартигалонг всоп
rose,жан-морис раффо шинон розе
sibona,дольчетто сибона
the,дьюарс монарх лет
neris,лис нерис пино гриджио
dessert,ля маркезина гран десерт белый
lambrusco,ривата ламбруско эмилия россо
anejo,гавана клуб года
rich,рич милк карамель лотте
cava,ферриоль
blanc,мерфи гуд совиньон блан
docg,серраденари бароло ла ветта
otard,коньяк отард хо золотой
carinena,бесо де вино олд вайн гарнача
docg,винья'нджена
classe,шато кос лабори
valle,сыр полутвердый
real,реал компанья велья роял опорто колейта
bouju,даниэль бужу хо
vintage,копке винтедж порто
victoria,просекко виктория белое брют
calatayud,виньяс де мьедес тинто
reserve,метакса приват резерв
klassik,лет шардоне классик
babylon's,бебилон'с пик с-м-г шираз-мурведр-гренаш
sekt,купферберг голд зект розе
lucien,люсьен альбрехт брют розе креман д'эльзас аос
bordeaux,рок дю пренс блан полусладкое бордо
la,домен де ля санглиер ля ривьера
salmon,идеальное очетание лосось и форель совиньон блан
fairies,феи детское безалкогольное шампанское
albarino,корал до мар альбариньо
albarino,мартин кодакс органиструм альбариньо
lacassan,шевалье лакассан брют
chateau,шато дю люкат бордо аос
label,лансон розе лейбл брют
muller,каватина мюллер-тургау брют
vsop,а де фуссиньи пюр органик всоп
extra,мартель экстра олд
angelus,карденал мендоса анхелус
double,макаллан дабл каск лет
french,френч клише сира гренаш
brut,кампо вьехо кава брют резерва
rouge,шато ла гравьер
xdurance,рокстар иксдюранс
columbia,рамерси селлез каберне совиньон
bichot,альберт бишо шамболь-мюзиньи
cream,крим стаут
domaene,домен гобельсбург цвайгельт
moisans,муазон хо
beam,виски джим бим девил’з кат
premium,сырная тарелка чиз галери премиум сэт
premium,бинелли премиум ламбруско россо
le,ле фаре экстра брют
shiraz,нау бай пакстон шираз
igt,аббация ламбруско бьянко фриззанте
di,сенсейшен просекко ди конельяно вальдоббьядене супериоре
blanc,вальдо оро блан де блан экстра драй
caldas,портвейн калдаш порто тауни
vitoria,маркиз де виториа крианса
peter,петер мертес глинтвейн
oro,вальдо марка оро розе брют
green,жак сено грин
goedverwacht,грейт экспектейшнс шираз
chastenay,викторин де шастенэ креман де бургонь брют розе аос
schogetten,шоколад шогеттен кофе трилогия
bisquit,коньяк бисквит всоп бокала
vitapress,тачки детское безалкогольное шампанское
riesling,хидлер рид лангенлуа штайнхауз рислинг
don,дон гуидо педро хименес солера эспесиаль
spiegelau,шпигелау аутентис набор из х бокалов для минеральной воды
terre,тавернелло бьянко
rose,еужен розе
